"1","The AI boom is already reshaping America. Cities often left out of earlier boomtimes are basking in their newfound prosperity—for as long as it lasts.","often","x","2025-11-04 10:02:25","2025-11-04 10:02:25"
"2","with only one billion dollars we have improved swebench performance by a full 3%. after 500m on compute and 500m on data sadly there’s no money remaining to improve the benchmark itself. but worry not as we have ten billion planned for next time","not","x","2025-11-04 10:15:43","2025-11-04 10:15:43"
"3","Disregard warnings unless they're saying you can't run perf due to missing packages; you may get some warnings about not being able to access kernel module samples which you're not after anyway.","after","unknown","2025-11-04 11:43:05","2025-11-04 12:44:34"
"4","Node.js is built against modern versions of V8.","against","unknown","2025-11-04 11:44:15","2025-11-04 12:44:34"
"5","When you work with a lesser filesystem, you can always downsample appropriately, with comparison functions as required by the behavior of the filesystem on which your program is running.","as","unknown","2025-11-04 11:45:35","2025-11-04 12:44:34"
"6","What constitutes as best practice is non-contradictory practice.","as","unknown","2025-11-04 11:45:35","2025-11-04 12:44:34"
"7","You could use an after_deliver to record the delivery of the message. It also allows observer/interceptor-like behaviors, but with access to the full mailer context.","but","unknown","2025-11-04 11:48:48","2025-11-04 12:44:34"
"8","This component computes visibleTodos by taking the todos it receives by props and filtering them according to the filter prop.","by","unknown","2025-11-04 11:48:48","2025-11-04 12:44:34"
"9","You’ve separated them by purpose: two different things are synchronized by two separate Effects.","by","unknown","2025-11-04 11:48:48","2025-11-04 12:44:34"
"10","You have a huge opportunity because we know how hard it is to fully, deeply learn a programming language, and by using the same language to perform all your work on the web - both on the client and on the server, you're in a unique position of advantage.","by","unknown","2025-11-04 11:48:48","2025-11-04 12:44:34"
"11","Writing WebAssembly (.wat) by hand and converting to binary format using tools such as wabt","by","unknown","2025-11-04 11:48:48","2025-11-04 12:44:34"
"12","Node.js loads modules following the Module Resolution Algorithm. Therefore, it assumes the directory in which a module is requested (require) is trusted. By that, it means the following application behavior is expected. Assuming the following directory structure:","by","unknown","2025-11-04 11:48:48","2025-11-04 12:44:34"
"13","By placing the callback in a process.nextTick(), the script still has the ability to run to completion, allowing all the variables, functions, etc., to be initialized prior to the callback being called.","by","unknown","2025-11-04 11:48:48","2025-11-04 12:44:34"
"14","The format uses placeholder names formed by $ with valid Python identifiers (alphanumeric characters and underscores). Surrounding the placeholder with braces allows it to be followed by more alphanumeric letters with no intervening spaces. Writing $$ creates a single escaped $:","by","unknown","2025-11-04 11:48:48","2025-11-04 12:44:34"
"15","What constitutes as best practice is non-contradictory practice.","constitute","unknown","2025-11-04 11:48:48","2025-11-04 12:44:34"
"16","In other words, useEffect “delays” a piece of code from running until that render is reflected on the screen.","delay","unknown","2025-11-04 11:49:19","2025-11-04 12:44:34"
"17","You want to log a separate visit for different URLs since each URL represents a different page.","for","unknown","2025-11-04 11:51:43","2025-11-04 12:44:34"
"18","The client may preserve cookie contents even for expired cookies.","for","unknown","2025-11-04 11:51:43","2025-11-04 12:44:34"
"19","This comparison, when run for an acceptable amount unwillingly increases the response time of the request.","for","unknown","2025-11-04 11:51:43","2025-11-04 12:44:34"
"20","Secondly, not everything must be typed explicitly—TypeScript infers types for us. For example, the variable isJustineAnAdult is of type boolean even if we didn't type it explicitly, and justine would be a valid argument for our function even though we didn't declare this variable as of User type.","for","unknown","2025-11-04 11:51:43","2025-11-04 12:44:34"
"21","This means you're counting on node to send the headers for you at the correct time before you start sending body data.","for","unknown","2025-11-04 11:51:43","2025-11-04 12:44:34"
"22","This is the slow and gradual debt accumulating from growing memory usage.","from","unknown","2025-11-04 12:10:49","2025-11-04 12:44:34"
"23","The position is computed from adding offset to a reference point; the reference point is selected by the whence argument. ","from","unknown","2025-11-04 12:10:49","2025-11-04 12:44:34"
"24","Please note, you can get up and running with the Serverless Framework CLI and Dashboard for free, and the CLI will always be free for small orgs and indiehackers.","get","unknown","2025-11-04 12:10:49","2025-11-04 12:44:34"
"25","When testing is complete, getting the fix to the customer is as simple as pushing the updated image to the production environment.","get","unknown","2025-11-04 12:10:49","2025-11-04 12:44:34"
"26","If your Effect animates something in, the cleanup function should reset the animation to the initial values:","in","unknown","2025-11-04 12:10:49","2025-11-04 12:44:34"
"27","By comparing the request response times, an attacker can guess the length and the value of the password in a large quantity of requests.","in","unknown","2025-11-04 12:10:49","2025-11-04 12:44:34"
"28","If one of your API clients is a browser, you might want to add one of these back in:","in","unknown","2025-11-04 12:10:49","2025-11-04 12:44:34"
"29","Exceptions come in different types, and the type is printed as part of the message: the types in the example are ZeroDivisionError, NameError and TypeError.","in","unknown","2025-11-04 12:10:49","2025-11-04 12:44:34"
"30","The third layer copies in an application’s specific requirements.txt file.","in","unknown","2025-11-04 12:10:49","2025-11-04 12:44:34"
"31","While that will take a few minutes to complete, in another shell we may run a script that takes Node.js' module zlib, that wraps around another compression tool, gzip(1).","may","unknown","2025-11-04 12:10:49","2025-11-04 12:44:34"
"32","As a developer, you are more than encouraged to use them too!","more","unknown","2025-11-04 12:10:49","2025-11-04 12:44:34"
"33","The trick to adding these back in is that, by default, they are passed session_options when added (including the session key), so you can't just add a session_store.rb initializer, add use ActionDispatch::Session::CookieStore and have sessions functioning as usual.","not","unknown","2025-11-04 12:10:49","2025-11-04 12:44:34"
"34","with only one billion dollars we have improved swebench performance by a full 3%. after 500m on compute and 500m on data sadly there’s no money remaining to improve the benchmark itself. but worry not as we have ten billion planned for next time","not","unknown","2025-11-04 12:10:49","2025-11-04 12:44:34"
"35","You have a huge opportunity because we know how hard it is to fully, deeply learn a programming language, and by using the same language to perform all your work on the web - both on the client and on the server, you're in a unique position of advantage.","of","unknown","2025-11-04 12:10:49","2025-11-04 12:44:34"
"36","Secondly, not everything must be typed explicitly—TypeScript infers types for us. For example, the variable isJustineAnAdult is of type boolean even if we didn't type it explicitly, and justine would be a valid argument for our function even though we didn't declare this variable as of User type.","of","unknown","2025-11-04 12:10:49","2025-11-04 12:44:34"
"37","This means that Rack::Cache will store off the Last-Modified value for a URL in the Rails cache, and add an If-Modified-Since header to any subsequent inbound requests for the same URL.","off","unknown","2025-11-04 12:10:49","2025-11-04 12:44:34"
"38","Interceptors allow you to make modifications to emails before they are handed off to the delivery agents.","off","unknown","2025-11-04 12:10:49","2025-11-04 12:44:34"
"39","The AI boom is already reshaping America. Cities often left out of earlier boomtimes are basking in their newfound prosperity—for as long as it lasts.","often","unknown","2025-11-04 12:10:49","2025-11-04 12:44:34"
"40","See the section on 'Enabling remote debugging scenarios' on some advice on how to safely allow remote debugger clients to connect.","on","unknown","2025-11-04 12:10:49","2025-11-04 12:44:34"
"41","This includes branching on secrets and, when the attacker could be co-located on the same infrastructure (e.g., same cloud machine), using a secret as an index into memory. ","on","unknown","2025-11-04 12:10:49","2025-11-04 12:44:34"
"42","However, it is good practice to be as specific as possible with the types of exceptions that we intend to handle, and to allow any unexpected exceptions to propagate on.","on","unknown","2025-11-04 12:10:49","2025-11-04 12:44:34"
"43","Here are some values for this header for some popular servers, once these servers are configured to support accelerated file sending:","once","unknown","2025-11-04 12:10:49","2025-11-04 12:44:34"
"44","However, when pinning a dependency to an exact version, its transitive dependencies are not themselves pinned. ","oneself","unknown","2025-11-04 12:10:49","2025-11-04 12:44:34"
"45","Usually, the class containing the method is itself defined in this global scope, and in the next section we’ll find some good reasons why a method would want to reference its own class.","oneself","unknown","2025-11-04 12:10:49","2025-11-04 12:44:34"
"46","HTTP requests are received by the Node.js HTTP server and handed over to the application code via the registered request handler. The server does not parse the content of the request body. Therefore any DoS caused by the contents of the body after they are handed over to the request handler is not a vulnerability in Node.js","over","unknown","2025-11-04 12:10:49","2025-11-04 12:44:34"
"47","Our applications can now run for hours inside a browser, rather than being just a few form validation rules or simple scripts.","rather","unknown","2025-11-04 12:10:49","2025-11-04 12:44:34"
"48","Once users with SHA1 digested signed cookies should no longer have a chance to have their cookies rewritten, remove the rotation.","should","unknown","2025-11-04 12:10:49","2025-11-04 12:44:34"
"49","As this component grows, so does the amount of state logic sprinkled throughout it.","so","unknown","2025-11-04 12:10:49","2025-11-04 12:44:34"
"50","You can apply this principle to array iterations and so forth.","so","unknown","2025-11-04 12:10:49","2025-11-04 12:44:34"
"51","In the other direction, going west, it is some ten minutes to Sakura Park, and walking northward from there brings you toward Harlem, along the Hudson, though traffic makes the river on the other side of the trees inaudible.","some","unknown","2025-11-04 12:10:49","2025-11-04 12:44:34"
"52","Spinning up a VM only to isolate a single application is a lot of overhead.","spin","unknown","2025-11-04 12:10:49","2025-11-04 12:44:34"
"53","The application using the ABI must be compiled such that the available addresses, expected parameter values, and memory structure sizes and layouts agree with those with which the ABI provider was compiled. ","such","unknown","2025-11-04 12:10:49","2025-11-04 12:44:34"
"54","The use of experimental features in production isn't recommended. Experimental features can suffer breaking changes if needed, and their functionality isn't securely stable. ","suffer","unknown","2025-11-04 12:10:49","2025-11-04 12:44:34"
"55","While that will take a few minutes to complete, in another shell we may run a script that takes Node.js' module zlib, that wraps around another compression tool, gzip(1).","take","unknown","2025-11-04 12:10:49","2025-11-04 12:44:34"
"56","For example, do not assume that because your program is running on Darwin that you are therefore working on a case-insensitive filesystem (HFS+), as the user may be using a case-sensitive filesystem (HFSX). ","that","unknown","2025-11-04 12:10:49","2025-11-04 12:44:34"
"57","You may list all the in progress features available on each Node.js release by grepping through the --v8-options argument.","through","unknown","2025-11-04 12:10:49","2025-11-04 12:44:34"
"58","The exponential behavior is triggered when there is a mismatch but Node.js can't be certain until it tries many paths through the input string.","through","unknown","2025-11-04 12:10:49","2025-11-04 12:44:34"
"59","Just as you would never automatically rewrite user file data to uppercase the data or normalize CRLF to LF line-endings, so you should never change, interfere or corrupt filenames or timestamps through case / Unicode form / timestamp normalization.","through","unknown","2025-11-04 12:10:49","2025-11-04 12:44:34"
"60","In this counter-example of good practice, the application's code forces data through whenever it is available (signaled by the 'data' event):","through","unknown","2025-11-04 12:10:49","2025-11-04 12:44:34"
"61","Think of this as creating configuration to let you to connect through the isolated environment of the container.","through","unknown","2025-11-04 12:10:49","2025-11-04 12:44:34"
"62","For example a test and thus a functionality of your product could pass when NODE_ENV is set to development but fail when setting NODE_ENV to production. ","thus","unknown","2025-11-04 12:10:49","2025-11-04 12:44:34"
"63","However, this particular fade-in animation is both simpler and much more efficient to implement with a plain CSS Animation:","to","unknown","2025-11-04 12:10:49","2025-11-04 12:44:34"
"64","WebSocket achieves HTTP compatibility by using the HTTP Upgrade header to transition protocols.","to","unknown","2025-11-04 12:10:49","2025-11-04 12:44:34"
"65","Alternatively, some opt to create a test/ sibling to src/ (\"'src' and 'test' fully segregated\"), either with a mirrored structure or a \"junk drawer\".","to","unknown","2025-11-04 12:10:49","2025-11-04 12:44:34"
"66","As a result, the callback tries to reference bar even though it may not have that variable in scope yet, because the script has not been able to run to completion.","to","unknown","2025-11-04 12:10:49","2025-11-04 12:44:34"
"67","You have two options for a destination Worker Pool to which to offload work.","to","unknown","2025-11-04 12:10:49","2025-11-04 12:44:34"
"68","If you read shorter files for some users and longer files for others, fs.readFile() may introduce significant variation in Task lengths, to the detriment of Worker Pool throughput.","to","unknown","2025-11-04 12:10:49","2025-11-04 12:44:34"
"69","To these ends Node.js has introduced N-API in version 8.6.0 and marked it as a stable component of the project as of Node.js 8.12.0. The API is defined in the headers node_api.h and node_api_types.h, and provides a forward- compatibility guarantee that crosses the Node.js major version boundary. The guarantee can be stated as follows:","to","unknown","2025-11-04 12:10:49","2025-11-04 12:44:34"
"70","Additionally, from outside the custom stream, there are pitfalls to ignoring backpressure.","to","unknown","2025-11-04 12:10:49","2025-11-04 12:44:34"
"71","Parameter annotations are defined by a colon after the parameter name, followed by an expression evaluating to the value of the annotation.","to","unknown","2025-11-04 12:10:49","2025-11-04 12:44:34"
"72","To that end, the threading module provides a number of synchronization primitives including locks, events, condition variables, and semaphores.","to","unknown","2025-11-04 12:10:49","2025-11-04 12:44:34"
"73","This Effect updates the messages state variable with a newly created array every time a new message arrives:","with","unknown","2025-11-04 12:10:49","2025-11-04 12:44:34"
"74","The Node.js ecosystem is huge and thanks to V8 which also powers desktop apps, with projects like Electron.","with","unknown","2025-11-04 12:10:49","2025-11-04 12:44:34"
"75","This might seem counter-intuitive, but since the introduction of Google Maps in 2004, JavaScript has evolved from a language that was generally executing a few dozens of lines of code to complete applications with thousands to hundreds of thousands of lines running in the browser.","with","unknown","2025-11-04 12:10:49","2025-11-04 12:44:34"
"76","Node.js provides a simple way to list all dependencies and respective versions that ship with a specific binary through the process global object.","with","unknown","2025-11-04 12:10:49","2025-11-04 12:44:34"
"77","Using emscripten with a C/C++ application / Using wasm-pack with a Rust application","with","unknown","2025-11-04 12:10:49","2025-11-04 12:44:34"
"78","The remaining responsibility for ensuring ABI compatibility lies with the team maintaining the header files which provide the API that results, upon compilation, in the ABI that is to remain stable.","with","unknown","2025-11-04 12:10:49","2025-11-04 12:44:34"
"79","While the two processes start the same and seem to work the GC at the same rate, it becomes evident that after a few seconds with a properly working backpressure system in place, it spreads the GC load across consistent intervals of 4-8 milliseconds until the end of the data transfer.","with","unknown","2025-11-04 12:10:49","2025-11-04 12:44:34"
"80","As with middleware, this will leave out any Action Controller modules that provide functionalities primarily used by browser applications.","with","unknown","2025-11-04 12:10:49","2025-11-04 12:44:34"
"81","The above layout is in a file mailer.html.erb. The default layout name is specified in the ApplicationMailer, as we saw earlier with the line layout \"mailer\" in the Generate Mailer section.","with","unknown","2025-11-04 12:10:49","2025-11-04 12:44:34"
"82","Callbacks can be specified with a block or a symbol representing a method name in the mailer class, similar to other callbacks (in controllers or models).","with","unknown","2025-11-04 12:10:49","2025-11-04 12:44:34"
"83","The format uses placeholder names formed by $ with valid Python identifiers (alphanumeric characters and underscores). Surrounding the placeholder with braces allows it to be followed by more alphanumeric letters with no intervening spaces. Writing $$ creates a single escaped $:","with","unknown","2025-11-04 12:10:49","2025-11-04 12:44:34"
"84","For instance to change the digest used for signed cookies from SHA1 to SHA256, you would first assign the new configuration value:","would","unknown","2025-11-04 12:10:49","2025-11-04 12:44:34"
